{
  "schemaVersion": 1,
  "compiler": { "version": "0.1.0-dev" },
  "inputDigest": "8d19b9f13a6f2f77908791d85f4ea08e64f3f142603a6660ebd4d98a0a2d3efa",
  "targetProfile": "v146",
  "layoutFingerprint": "55362f94d5f79e2c49291460a1b8e9395c7f8112b3d1d847929d28c271077066",
  "runtimeTopology": {
    "blueprint": {
      "file": "runtime.msch",
      "blocks": ["processor", "memory"]
    },
    "shards": [
      { "id": "Main", "processor": "hyper", "mlog": "Main.mlog", "roles": ["main"], "blueprintPosition": { "x": 1, "y": 1 } },
      { "id": "Worker-0", "processor": "logic", "mlog": "Worker-0.mlog", "roles": ["worker"], "blueprintPosition": { "x": 4, "y": 0 } }
    ],
    "memorySegments": [
      {
        "id": "bank__mpl_mem0",
        "kind": "bank",
        "capacity": 512,
        "usedSlots": 134,
        "blueprintPosition": { "x": 6, "y": 0 },
        "bindings": [
          { "shard": "Main", "alias": "bank__mpl_mem0", "access": "readWrite", "autoConnected": true },
          { "shard": "Worker-0", "alias": "bank__mpl_mem0", "access": "readWrite", "autoConnected": true }
        ]
      }
    ],
    "sharedRuntime": {
      "magic": 5066828,
      "abiVersion": 2,
      "fingerprint": 150158518,
      "epoch": 1648766121,
      "mainShard": "Main",
      "workers": ["Worker-0"],
      "slots": 12,
      "readyIndex": 4,
      "acknowledgementIndexes": { "Worker-0": 5 },
      "heartbeatIndexes": { "Worker-0": 6 },
      "slices": [
        { "memory": "bank__mpl_mem0", "offset": 122, "logicalStart": 0, "length": 7 }
      ],
      "mailboxes": [
        {
          "id": "Requests",
          "producer": "Main",
          "consumer": "Worker-0",
          "payloadSlots": 2,
          "slots": 5,
          "slices": [
            { "memory": "bank__mpl_mem0", "offset": 129, "logicalStart": 0, "length": 5 }
          ]
        }
      ]
    }
  },
  "externalHardware": [
    { "mplName": "AlertBoard", "ownerShard": "Main", "alias": "message1", "type": "Message", "access": "write" },
    { "mplName": "MainScreen", "ownerShard": "Main", "alias": "display1", "type": "Display", "access": "write" }
  ],
  "logicalDisplays": [],
  "prerequisites": [
    { "kind": "mapRule", "value": "logicUnitControl" }
  ]
}
